"id","title","artist","date","room"
5178,"Attendant to the King of Hell","Unknown",null,"G206"
5179,"Water Vessel","Unknown",null,"G206"
6604,"Maebyeong with flying cranes and clouds",null,"12th century","G206"
6647,"Bowl with lotus petals",null,"first half 12th century","G206"
6652,"Covered box with wavy lines and chrysanthemums",null,"second half 15th century","G206"
6653,"Bottle with peony leaves",null,"second half 15th century","G206"
8358,"Lidded Jar with Handle","Unknown",null,"G206"
8359,"Jar","Unknown","2nd century BCE","G206"
24037,"Ceremonial Jar and Stand","Unknown",null,"G206"
99406,"Grapevines","Unknown","late 19th century","G206"
122570,"Small Jar with Perforated Foot and Stamped and Incised Designs",null,"late 6th - early 7th century","G206"
122572,"Bottle with combed pattern",null,"9th century","G206"
122581,"Ewer in the shape of a melon",null,"first half 12th century","G206"
122582,"Lobed maebyeong","Unknown","13th century","G206"
122586,"Covered box with chrysanthemums",null,"13th century","G206"
122589,"Bottle with floral design",null,"late 15th century","G206"
122618,"Water vessel (Kundika) ","Unknown","918-1392","G206"
122620,"Decorative hanging panel of an official’s robe",null,"19th century","G206"
