"id","title","artist","date","room"
129028,"Golden Age: Night View at a Villa (Zensei Bessō yoru no kei)","Toyohara Kunichika","August 1889","G227"
129029,"Portrait of Beautiful Women in a Picture of Kyoto (Miyako utsushi bijin sugata-e)","Toyohara Kunichika","December 1888","G227"
129044,"Garden at Night (Yoru no niwa)","Utagawa Kunisada","1853, 12th lunar month","G227"
129047,"Playing the Koto","Utagawa Kunisada","1847-1850","G227"
129049,"Snow, Moon, Flowers","Utagawa Kunisada","1853, 2nd lunar month","G227"
129052,"The Picture Contest: View of Saga (E-awase: Saga no fūkei)","Utagawa Kunisada","1853, 4th lunar month","G227"
129054,"A Garden in March (Yayoi no niwa)","Utagawa Kunisada","1849-1850","G227"
