"id","title","artist","date","room"
37185,"Chinese Children Playing with an Elephant","Nagasawa Rosetsu","late 18th century","G252"
118455,"The Four Elegant Pastimes","Shibata Zeshin","second half 19th century","G252"
118456,"The Four Elegant Pastimes","Shibata Zeshin","second half 19th century","G252"
122262,"Parakeets among Hydrangeas and Poppies","Sō Shiseki","after 1770","G252"
122531,"Candlestand of a crane on a long-tailed tortoise",null,"18th century","G252"
122535,"Vase with Rin Nasei (Ch. Lin Hejing) and crane",null,"18th-19th century","G252"
123100,"Chinese Children Playing with an Elephant","Nagasawa Rosetsu","late 18th century","G252"
123830,"Waterfall","Watanabe Seitei","late 19th-early 20th century","G252"
