"id","title","artist","date","room"
8568,"Chinese Sages in a Mountain Retreat","Kan? Eitoku","c. 1580","G222"
8662,"Literati in a Mountain Retreat","Kan? Eitoku","c. 1580","G222"
27880,"Censer",null,"16th century","G222"
34414,"Crows and Cryptomeria","Signed Ryoshin, dates unknown",null,"G222"
59617,"Formal Audience Hall (Shoin)","Yasuimoku Komuten Company Ltd.","constructed 2001","G222"
62718,"Kannon with Landscape and Tiger","Kan? Tan'y?",null,"G222"
62720,"Kanon with Landscape and Tiger, from a set of three","Kan? Tan'y?",null,"G222"
62721,"Kanon with Landscape and Tiger, from a set of three","Kan? Tan'y?",null,"G222"
84440,"The Immortal Gama",null,"c. 1880","G222"
84441,"The Immortal Tekkai",null,"c. 1880","G222"
