"id","title","artist","date"
8568,"Chinese Sages in a Mountain Retreat","Kan? Eitoku","c. 1580"
8662,"Literati in a Mountain Retreat","Kan? Eitoku","c. 1580"
27880,"Censer",null,"16th century"
34414,"Crows and Cryptomeria","Signed Ryoshin, dates unknown",null
59617,"Formal Audience Hall (Shoin)","Yasuimoku Komuten Company Ltd.","constructed 2001"
62718,"Kannon with Landscape and Tiger","Kan? Tan'y?",null
62720,"Kanon with Landscape and Tiger, from a set of three","Kan? Tan'y?",null
62721,"Kanon with Landscape and Tiger, from a set of three","Kan? Tan'y?",null
84440,"The Immortal Gama",null,"c. 1880"
84441,"The Immortal Tekkai",null,"c. 1880"
