"id","title","artist","date","room"
99495,"Still Life Against Flowered Wallpaper","Arthur Dove","1909","G361"
99498,"Man Among the Redwoods","Marguerite Thompson Zorach","1912","G361"
116575,"Seated Woman with Flowers","Arthur B. Carles","c. 1922","G361"
116576,"Self Portrait with Hat","Arthur B. Carles","c. 1908","G361"
116578,"Figures Walking on a Road","Marguerite Thompson Zorach","1910","G361"
116580,"Two Nudes","Marguerite Thompson Zorach","c. 1922","G361"
116581,"Pitcher and Bowl of Fruit","Alfred H. Maurer","before 1914","G361"
116641,"Siesta","Morgan Russell","c. 1923","G361"
